{
  "artist_id": "opeth",
  "name": "Opeth",
  "country": "Sweden",
  "formed_year": 1990,
  "genres": [
    "Progressive Death Metal",
    "Progressive Rock"
  ],
  "total_parsed_tracks": 17,
  "albums": [
    {
      "album_id": "blackwater_park",
      "title": "Blackwater Park",
      "release_year": 2001,
      "total_tracks": 8,
      "parsed_tracks_count": 5,
      "track_ids": [
        "opeth_harvest",
        "opeth_bleak",
        "opeth_the_drapery_falls",
        "opeth_the_leper_affinity",
        "opeth_blackwater_park"
      ]
    },
    {
      "album_id": "deliverance",
      "title": "Deliverance",
      "release_year": 2000,
      "total_tracks": 2,
      "parsed_tracks_count": 2,
      "track_ids": [
        "opeth_masters_apprentices",
        "opeth_deliverance"
      ]
    },
    {
      "album_id": "watershed",
      "title": "Watershed",
      "release_year": 2000,
      "total_tracks": 3,
      "parsed_tracks_count": 3,
      "track_ids": [
        "opeth_heir_apparent",
        "opeth_porcelain_heart",
        "opeth_the_lotus_eater"
      ]
    },
    {
      "album_id": "ghost_reveries",
      "title": "Ghost Reveries",
      "release_year": 2005,
      "total_tracks": 8,
      "parsed_tracks_count": 3,
      "track_ids": [
        "opeth_harlequin_forest",
        "opeth_the_baying_of_the_hounds",
        "opeth_the_grand_conjuration"
      ]
    },
    {
      "album_id": "still_life",
      "title": "Still Life",
      "release_year": 2000,
      "total_tracks": 1,
      "parsed_tracks_count": 1,
      "track_ids": [
        "opeth_the_moor"
      ]
    },
    {
      "album_id": "ghost_reveries_(2005)",
      "title": "Ghost Reveries (2005)",
      "release_year": 2000,
      "total_tracks": 1,
      "parsed_tracks_count": 1,
      "track_ids": [
        "opeth_ghost_of_perdition"
      ]
    },
    {
      "album_id": "single_/_tab_transcription",
      "title": "Single / Tab Transcription",
      "release_year": 2000,
      "total_tracks": 1,
      "parsed_tracks_count": 1,
      "track_ids": [
        "opeth_burden"
      ]
    },
    {
      "album_id": "my_arms,_your_hearse",
      "title": "My arms, your hearse",
      "release_year": 2000,
      "total_tracks": 1,
      "parsed_tracks_count": 1,
      "track_ids": [
        "opeth_demon_of_the_fall"
      ]
    }
  ]
}