{
  "artist_id": "between_the_buried_and_me",
  "name": "Between the Buried and Me",
  "country": "United States",
  "formed_year": 2000,
  "genres": [
    "Progressive Metal",
    "Technical Death Metal",
    "Mathcore"
  ],
  "total_parsed_tracks": 1,
  "albums": [
    {
      "album_id": "alaska",
      "title": "Alaska",
      "release_year": 2005,
      "total_tracks": 11,
      "parsed_tracks_count": 1,
      "track_ids": [
        "between_the_buried_and_me_alaska"
      ]
    }
  ]
}