{
  "artist_id": "epica",
  "name": "Epica",
  "country": "Netherlands",
  "formed_year": 2002,
  "genres": [
    "Symphonic Metal",
    "Progressive Metal",
    "Gothic Metal"
  ],
  "total_parsed_tracks": 4,
  "albums": [
    {
      "album_id": "consign_to_oblivion",
      "title": "Consign to Oblivion",
      "release_year": 2005,
      "total_tracks": 11,
      "parsed_tracks_count": 1,
      "track_ids": [
        "epica_the_last_crusade"
      ]
    },
    {
      "album_id": "requiem_for_the_indifferent",
      "title": "Requiem for the Indifferent",
      "release_year": 2012,
      "total_tracks": 13,
      "parsed_tracks_count": 1,
      "track_ids": [
        "epica_requiem_for_the_indifferent"
      ]
    },
    {
      "album_id": "the_phantom_agony_(2003)",
      "title": "The Phantom Agony (2003)",
      "release_year": 2000,
      "total_tracks": 1,
      "parsed_tracks_count": 1,
      "track_ids": [
        "epica_sensorium"
      ]
    },
    {
      "album_id": "phanton_agony",
      "title": "Phanton Agony",
      "release_year": 2000,
      "total_tracks": 1,
      "parsed_tracks_count": 1,
      "track_ids": [
        "epica_cry_for_the_moon"
      ]
    }
  ]
}