{
  "artist_id": "porcupine_tree",
  "name": "Porcupine Tree",
  "country": "United Kingdom",
  "formed_year": 1987,
  "genres": [
    "Progressive Rock",
    "Progressive Metal",
    "Art Rock"
  ],
  "total_parsed_tracks": 4,
  "albums": [
    {
      "album_id": "deadwing",
      "title": "Deadwing",
      "release_year": 2005,
      "total_tracks": 9,
      "parsed_tracks_count": 1,
      "track_ids": [
        "porcupine_tree_halo"
      ]
    },
    {
      "album_id": "in_absentia",
      "title": "In Absentia",
      "release_year": 2002,
      "total_tracks": 12,
      "parsed_tracks_count": 3,
      "track_ids": [
        "porcupine_tree_the_sound_of_muzak",
        "porcupine_tree_trains",
        "porcupine_tree_blackest_eyes"
      ]
    }
  ]
}