{
  "artist_id": "unknown",
  "name": "Unknown Artist",
  "country": "Unknown",
  "formed_year": 1990,
  "genres": [
    "Progressive Metal"
  ],
  "total_parsed_tracks": 1,
  "albums": [
    {
      "album_id": "single_/_tab_transcription",
      "title": "Single / Tab Transcription",
      "release_year": 2000,
      "total_tracks": 1,
      "parsed_tracks_count": 1,
      "track_ids": [
        "unknown_artist_megadeth_99_ways_to_die"
      ]
    }
  ]
}